{
  "schema_version": "0.1",
  "site_id": "annex_multi",
  "site_name": "Red Hat Annex (staged clips 1 and 7)",
  "map": {
    "center": {
      "lat": 35.775294,
      "lon": -78.637673
    },
    "zoom": 18,
    "site_image": null
  },
  "cameras": [
    {
      "camera_id": "cam_04",
      "name": "Route 2: street corner sidewalk",
      "take": 2,
      "position": {
        "lat": 35.775,
        "lon": -78.6387
      },
      "site_xy": null,
      "heading_deg": null,
      "neighbors": [
        {
          "camera_id": "cam_05",
          "travel_time_s": 3.0,
          "direction": "south"
        }
      ],
      "source": {
        "kind": "replay",
        "uri": "data/raw/staged/take2/clip7_cam1.mp4",
        "start_ts": 1.43
      }
    },
    {
      "camera_id": "cam_05",
      "name": "Route 2: sidewalk by bollard",
      "take": 2,
      "position": {
        "lat": 35.7749,
        "lon": -78.6387
      },
      "site_xy": null,
      "heading_deg": null,
      "neighbors": [
        {
          "camera_id": "cam_04",
          "travel_time_s": 3.0,
          "direction": "north"
        },
        {
          "camera_id": "cam_06",
          "travel_time_s": 3.0,
          "direction": "south"
        }
      ],
      "source": {
        "kind": "replay",
        "uri": "data/raw/staged/take2/clip7_cam2.mp4",
        "start_ts": 11.2
      }
    },
    {
      "camera_id": "cam_06",
      "name": "Route 2: crosswalk sidewalk",
      "take": 2,
      "position": {
        "lat": 35.77481,
        "lon": -78.6387
      },
      "site_xy": null,
      "heading_deg": null,
      "neighbors": [
        {
          "camera_id": "cam_05",
          "travel_time_s": 3.0,
          "direction": "north"
        }
      ],
      "source": {
        "kind": "replay",
        "uri": "data/raw/staged/take2/clip7_cam3.mp4",
        "start_ts": 18.45
      }
    },
    {
      "camera_id": "cam_07",
      "name": "Route 3: sidewalk by street parking",
      "take": 3,
      "position": {
        "lat": 35.7755,
        "lon": -78.6371
      },
      "site_xy": null,
      "heading_deg": null,
      "neighbors": [
        {
          "camera_id": "cam_08",
          "travel_time_s": 7.0,
          "direction": "north"
        }
      ],
      "source": {
        "kind": "replay",
        "uri": "data/raw/staged/take3/clip1_cam1.mp4",
        "start_ts": 0.8
      }
    },
    {
      "camera_id": "cam_08",
      "name": "Route 3: sidewalk by painted parklet",
      "take": 3,
      "position": {
        "lat": 35.7757,
        "lon": -78.637
      },
      "site_xy": null,
      "heading_deg": null,
      "neighbors": [
        {
          "camera_id": "cam_07",
          "travel_time_s": 7.0,
          "direction": "south"
        },
        {
          "camera_id": "cam_09",
          "travel_time_s": 6.0,
          "direction": "southeast"
        }
      ],
      "source": {
        "kind": "replay",
        "uri": "data/raw/staged/take3/clip1_cam2.mp4",
        "start_ts": 14.0
      }
    },
    {
      "camera_id": "cam_09",
      "name": "Route 3: crosswalk corner",
      "take": 3,
      "position": {
        "lat": 35.7756,
        "lon": -78.6368
      },
      "site_xy": null,
      "heading_deg": null,
      "neighbors": [
        {
          "camera_id": "cam_08",
          "travel_time_s": 6.0,
          "direction": "northwest"
        },
        {
          "camera_id": "cam_10",
          "travel_time_s": 3.0,
          "direction": "southeast"
        }
      ],
      "source": {
        "kind": "replay",
        "uri": "data/raw/staged/take3/clip1_cam3.mp4",
        "start_ts": 22.6
      }
    },
    {
      "camera_id": "cam_10",
      "name": "Route 3: sidewalk by building column",
      "take": 3,
      "position": {
        "lat": 35.77555,
        "lon": -78.63671
      },
      "site_xy": null,
      "heading_deg": null,
      "neighbors": [
        {
          "camera_id": "cam_09",
          "travel_time_s": 3.0,
          "direction": "northwest"
        }
      ],
      "source": {
        "kind": "replay",
        "uri": "data/raw/staged/take3/clip1_cam4.mp4",
        "start_ts": 30.76
      }
    }
  ]
}
