{
  "schema_version": "0.1",
  "site_id": "annex_clip1",
  "site_name": "Red Hat Annex (staged clip 1)",
  "map": {
    "center": {
      "lat": 35.775521,
      "lon": -78.636984
    },
    "zoom": 18,
    "site_image": null
  },
  "cameras": [
    {
      "camera_id": "cam_07",
      "name": "Route 3: sidewalk by street parking",
      "take": 3,
      "position": {
        "lat": 35.77545,
        "lon": -78.637095
      },
      "site_xy": null,
      "heading_deg": null,
      "neighbors": [
        {
          "camera_id": "cam_08",
          "travel_time_s": 7.0,
          "direction": "east"
        }
      ],
      "source": {
        "kind": "replay",
        "uri": "data/raw/staged/take3/clip1_cam1.mp4",
        "start_ts": 0.8
      }
    },
    {
      "camera_id": "cam_08",
      "name": "Route 3: sidewalk by painted parklet",
      "take": 3,
      "position": {
        "lat": 35.77545,
        "lon": -78.636873
      },
      "site_xy": null,
      "heading_deg": null,
      "neighbors": [
        {
          "camera_id": "cam_07",
          "travel_time_s": 7.0,
          "direction": "west"
        },
        {
          "camera_id": "cam_09",
          "travel_time_s": 6.0,
          "direction": "north"
        }
      ],
      "source": {
        "kind": "replay",
        "uri": "data/raw/staged/take3/clip1_cam2.mp4",
        "start_ts": 14.0
      }
    },
    {
      "camera_id": "cam_09",
      "name": "Route 3: crosswalk corner",
      "take": 3,
      "position": {
        "lat": 35.775593,
        "lon": -78.636873
      },
      "site_xy": null,
      "heading_deg": null,
      "neighbors": [
        {
          "camera_id": "cam_08",
          "travel_time_s": 6.0,
          "direction": "south"
        },
        {
          "camera_id": "cam_10",
          "travel_time_s": 3.0,
          "direction": "west"
        }
      ],
      "source": {
        "kind": "replay",
        "uri": "data/raw/staged/take3/clip1_cam3.mp4",
        "start_ts": 22.6
      }
    },
    {
      "camera_id": "cam_10",
      "name": "Route 3: sidewalk by building column",
      "take": 3,
      "position": {
        "lat": 35.775593,
        "lon": -78.637095
      },
      "site_xy": null,
      "heading_deg": null,
      "neighbors": [
        {
          "camera_id": "cam_09",
          "travel_time_s": 3.0,
          "direction": "east"
        }
      ],
      "source": {
        "kind": "replay",
        "uri": "data/raw/staged/take3/clip1_cam4.mp4",
        "start_ts": 30.76
      }
    }
  ]
}
