{
  "schema_version": "0.1",
  "site_id": "annex_placeholder",
  "site_name": "Red Hat Annex (PLACEHOLDER positions and times until filming)",
  "map": {"center": {"lat": 35.7753, "lon": -78.6370}, "zoom": 18, "site_image": null},
  "cameras": [
    {"camera_id": "cam_01", "name": "Route 1: south walkway", "position": {"lat": 35.7752, "lon": -78.6375}, "site_xy": null, "heading_deg": null,
     "neighbors": [{"camera_id": "cam_02", "travel_time_s": 30, "direction": "north"}],
     "source": {"kind": "replay", "uri": "data/raw/staged/take1/cam_01.mp4", "start_ts": 0}},
    {"camera_id": "cam_02", "name": "Route 1: west door", "position": {"lat": 35.7756, "lon": -78.6375}, "site_xy": null, "heading_deg": null,
     "neighbors": [{"camera_id": "cam_01", "travel_time_s": 30, "direction": "south"},
                   {"camera_id": "cam_03", "travel_time_s": 25, "direction": "north"},
                   {"camera_id": "cam_04", "travel_time_s": 30, "direction": "east"}],
     "source": {"kind": "replay", "uri": "data/raw/staged/take1/cam_02.mp4", "start_ts": 0}},
    {"camera_id": "cam_03", "name": "Route 1: north corner", "position": {"lat": 35.7760, "lon": -78.6375}, "site_xy": null, "heading_deg": null,
     "neighbors": [{"camera_id": "cam_02", "travel_time_s": 25, "direction": "south"}],
     "source": {"kind": "replay", "uri": "data/raw/staged/take1/cam_03.mp4", "start_ts": 0}},
    {"camera_id": "cam_04", "name": "Route 1: courtyard gate", "position": {"lat": 35.7756, "lon": -78.6370}, "site_xy": null, "heading_deg": null,
     "neighbors": [{"camera_id": "cam_02", "travel_time_s": 30, "direction": "west"}],
     "source": {"kind": "replay", "uri": "data/raw/staged/take1/cam_04.mp4", "start_ts": 0}},

    {"camera_id": "cam_05", "name": "Route 2: plaza steps", "position": {"lat": 35.7752, "lon": -78.6365}, "site_xy": null, "heading_deg": null,
     "neighbors": [{"camera_id": "cam_06", "travel_time_s": 28, "direction": "east"}],
     "source": {"kind": "replay", "uri": "data/raw/staged/take2/cam_05.mp4", "start_ts": 10}},
    {"camera_id": "cam_06", "name": "Route 2: side entrance", "position": {"lat": 35.7752, "lon": -78.6360}, "site_xy": null, "heading_deg": null,
     "neighbors": [{"camera_id": "cam_05", "travel_time_s": 28, "direction": "west"},
                   {"camera_id": "cam_07", "travel_time_s": 26, "direction": "east"},
                   {"camera_id": "cam_08", "travel_time_s": 32, "direction": "south"}],
     "source": {"kind": "replay", "uri": "data/raw/staged/take2/cam_06.mp4", "start_ts": 10}},
    {"camera_id": "cam_07", "name": "Route 2: east sidewalk", "position": {"lat": 35.7752, "lon": -78.6355}, "site_xy": null, "heading_deg": null,
     "neighbors": [{"camera_id": "cam_06", "travel_time_s": 26, "direction": "west"}],
     "source": {"kind": "replay", "uri": "data/raw/staged/take2/cam_07.mp4", "start_ts": 10}},
    {"camera_id": "cam_08", "name": "Route 2: loading dock", "position": {"lat": 35.7748, "lon": -78.6360}, "site_xy": null, "heading_deg": null,
     "neighbors": [{"camera_id": "cam_06", "travel_time_s": 32, "direction": "north"}],
     "source": {"kind": "replay", "uri": "data/raw/staged/take2/cam_08.mp4", "start_ts": 10}},

    {"camera_id": "cam_09", "name": "Route 3: bike rack", "position": {"lat": 35.7746, "lon": -78.6375}, "site_xy": null, "heading_deg": null,
     "neighbors": [{"camera_id": "cam_10", "travel_time_s": 32, "direction": "west"}],
     "source": {"kind": "replay", "uri": "data/raw/staged/take3/cam_09.mp4", "start_ts": 20}},
    {"camera_id": "cam_10", "name": "Route 3: crosswalk", "position": {"lat": 35.7746, "lon": -78.6380}, "site_xy": null, "heading_deg": null,
     "neighbors": [{"camera_id": "cam_09", "travel_time_s": 32, "direction": "east"},
                   {"camera_id": "cam_11", "travel_time_s": 24, "direction": "west"},
                   {"camera_id": "cam_12", "travel_time_s": 29, "direction": "north"}],
     "source": {"kind": "replay", "uri": "data/raw/staged/take3/cam_10.mp4", "start_ts": 20}},
    {"camera_id": "cam_11", "name": "Route 3: west sidewalk", "position": {"lat": 35.7746, "lon": -78.6385}, "site_xy": null, "heading_deg": null,
     "neighbors": [{"camera_id": "cam_10", "travel_time_s": 24, "direction": "east"}],
     "source": {"kind": "replay", "uri": "data/raw/staged/take3/cam_11.mp4", "start_ts": 20}},
    {"camera_id": "cam_12", "name": "Route 3: parking lot", "position": {"lat": 35.7750, "lon": -78.6380}, "site_xy": null, "heading_deg": null,
     "neighbors": [{"camera_id": "cam_10", "travel_time_s": 29, "direction": "south"}],
     "source": {"kind": "replay", "uri": "data/raw/staged/take3/cam_12.mp4", "start_ts": 20}}
  ]
}
