{
  "schema_version": "0.1",
  "site_id": "annex_duo",
  "site_name": "Red Hat Annex (staged clips 1 and 3)",
  "map": {
    "center": {
      "lat": 35.775537,
      "lon": -78.637048
    },
    "zoom": 18,
    "site_image": null
  },
  "cameras": [
    {
      "camera_id": "cam_07",
      "name": "Route 3: sidewalk by street parking",
      "take": 3,
      "position": {
        "lat": 35.77545,
        "lon": -78.637095
      },
      "site_xy": null,
      "heading_deg": null,
      "neighbors": [
        {
          "camera_id": "cam_08",
          "travel_time_s": 7.0,
          "direction": "east"
        }
      ],
      "source": {
        "kind": "replay",
        "uri": "data/raw/staged/take3/clip1_cam1.mp4",
        "start_ts": 0.8
      }
    },
    {
      "camera_id": "cam_08",
      "name": "Route 3: sidewalk by painted parklet",
      "take": 3,
      "position": {
        "lat": 35.77545,
        "lon": -78.636873
      },
      "site_xy": null,
      "heading_deg": null,
      "neighbors": [
        {
          "camera_id": "cam_07",
          "travel_time_s": 7.0,
          "direction": "west"
        },
        {
          "camera_id": "cam_09",
          "travel_time_s": 6.0,
          "direction": "north"
        }
      ],
      "source": {
        "kind": "replay",
        "uri": "data/raw/staged/take3/clip1_cam2.mp4",
        "start_ts": 14.0
      }
    },
    {
      "camera_id": "cam_09",
      "name": "Route 3: crosswalk corner",
      "take": 3,
      "position": {
        "lat": 35.775593,
        "lon": -78.636873
      },
      "site_xy": null,
      "heading_deg": null,
      "neighbors": [
        {
          "camera_id": "cam_08",
          "travel_time_s": 6.0,
          "direction": "south"
        },
        {
          "camera_id": "cam_10",
          "travel_time_s": 3.0,
          "direction": "west"
        }
      ],
      "source": {
        "kind": "replay",
        "uri": "data/raw/staged/take3/clip1_cam3.mp4",
        "start_ts": 22.6
      }
    },
    {
      "camera_id": "cam_10",
      "name": "Route 3: sidewalk by building column",
      "take": 3,
      "position": {
        "lat": 35.775593,
        "lon": -78.637095
      },
      "site_xy": null,
      "heading_deg": null,
      "neighbors": [
        {
          "camera_id": "cam_09",
          "travel_time_s": 3.0,
          "direction": "east"
        }
      ],
      "source": {
        "kind": "replay",
        "uri": "data/raw/staged/take3/clip1_cam4.mp4",
        "start_ts": 30.76
      }
    },
    {
      "camera_id": "cam_11",
      "name": "Route 4: patio planters",
      "take": 4,
      "position": {
        "lat": 35.77557,
        "lon": -78.637
      },
      "site_xy": null,
      "heading_deg": null,
      "neighbors": [
        {
          "camera_id": "cam_12",
          "travel_time_s": 8.0,
          "direction": "west"
        }
      ],
      "source": {
        "kind": "replay",
        "uri": "data/raw/staged/take4/clip3_cam1.mp4",
        "start_ts": 5.0
      }
    },
    {
      "camera_id": "cam_12",
      "name": "Route 4: cafe patio",
      "take": 4,
      "position": {
        "lat": 35.7755,
        "lon": -78.6373
      },
      "site_xy": null,
      "heading_deg": null,
      "neighbors": [
        {
          "camera_id": "cam_11",
          "travel_time_s": 8.0,
          "direction": "east"
        },
        {
          "camera_id": "cam_13",
          "travel_time_s": 6.0,
          "direction": "northeast"
        }
      ],
      "source": {
        "kind": "replay",
        "uri": "data/raw/staged/take4/clip3_cam2.mp4",
        "start_ts": 19.5
      }
    },
    {
      "camera_id": "cam_13",
      "name": "Route 4: patio planters (second angle)",
      "take": 4,
      "position": {
        "lat": 35.7756,
        "lon": -78.6371
      },
      "site_xy": null,
      "heading_deg": null,
      "neighbors": [
        {
          "camera_id": "cam_12",
          "travel_time_s": 6.0,
          "direction": "southwest"
        }
      ],
      "source": {
        "kind": "replay",
        "uri": "data/raw/staged/take4/clip3_cam3.mp4",
        "start_ts": 28.8
      }
    }
  ]
}
